{"$schema":"https://json-schema.org/draft/2020-12/schema","$id":"https://siq-agent-security/contracts/personal-platform-acceptance-report.v1.schema.json","title":"Personal platform evidence verification report (review only)","type":"object","additionalProperties":false,"required":["schema_version","candidate_sha","status","support_claim","evidence_files_checked","cases"],"properties":{"schema_version":{"const":"personal-platform-acceptance-report/v1"},"candidate_sha":{"type":"string","minLength":40,"maxLength":40,"pattern":"^[0-9a-f]{40}$"},"status":{"enum":["ready_for_review","needs_native_evidence"]},"support_claim":{"const":"not_assessed"},"evidence_files_checked":{"type":"integer","minimum":0,"maximum":576},"cases":{"type":"array","minItems":18,"maxItems":18,"items":{"type":"object","additionalProperties":false,"required":["target","native_checks_recorded","gaps","status"],"properties":{"target":{"type":"string","pattern":"^(openclaw|hermes|workbuddy)/(windows|macos|linux)/(amd64|arm64)/(native|wsl2)$"},"native_checks_recorded":{"type":"array","uniqueItems":true,"items":{"enum":["discovery","normal_execution","pre_execution_denial","service_unavailable_denial","approval_resume","final_parameter_recheck","skill_attribution","install_interception"]}},"gaps":{"type":"array","uniqueItems":true,"items":{"enum":["discovery","normal_execution","pre_execution_denial","service_unavailable_denial","approval_resume","final_parameter_recheck","skill_attribution","install_interception"]}},"status":{"enum":["ready_for_review","needs_native_evidence"]}}}}}}
