{
  "schema_version": "personal-platform-acceptance-report/v1",
  "candidate_sha": "b303c6f92392f3a44c306d81ad7323c6291ef4f2",
  "status": "needs_native_evidence",
  "support_claim": "not_assessed",
  "evidence_files_checked": 1,
  "cases": [
    {
      "target": "openclaw/windows/amd64/native",
      "native_checks_recorded": [],
      "gaps": [
        "discovery",
        "normal_execution",
        "pre_execution_denial",
        "service_unavailable_denial",
        "approval_resume",
        "final_parameter_recheck",
        "skill_attribution",
        "install_interception"
      ],
      "status": "needs_native_evidence"
    },
    {
      "target": "openclaw/windows/amd64/wsl2",
      "native_checks_recorded": [
        "normal_execution",
        "pre_execution_denial"
      ],
      "gaps": [
        "discovery",
        "service_unavailable_denial",
        "approval_resume",
        "final_parameter_recheck",
        "skill_attribution",
        "install_interception"
      ],
      "status": "needs_native_evidence"
    },
    {
      "target": "openclaw/macos/arm64/native",
      "native_checks_recorded": [],
      "gaps": [
        "discovery",
        "normal_execution",
        "pre_execution_denial",
        "service_unavailable_denial",
        "approval_resume",
        "final_parameter_recheck",
        "skill_attribution",
        "install_interception"
      ],
      "status": "needs_native_evidence"
    },
    {
      "target": "openclaw/macos/amd64/native",
      "native_checks_recorded": [],
      "gaps": [
        "discovery",
        "normal_execution",
        "pre_execution_denial",
        "service_unavailable_denial",
        "approval_resume",
        "final_parameter_recheck",
        "skill_attribution",
        "install_interception"
      ],
      "status": "needs_native_evidence"
    },
    {
      "target": "openclaw/linux/amd64/native",
      "native_checks_recorded": [],
      "gaps": [
        "discovery",
        "normal_execution",
        "pre_execution_denial",
        "service_unavailable_denial",
        "approval_resume",
        "final_parameter_recheck",
        "skill_attribution",
        "install_interception"
      ],
      "status": "needs_native_evidence"
    },
    {
      "target": "openclaw/linux/arm64/native",
      "native_checks_recorded": [],
      "gaps": [
        "discovery",
        "normal_execution",
        "pre_execution_denial",
        "service_unavailable_denial",
        "approval_resume",
        "final_parameter_recheck",
        "skill_attribution",
        "install_interception"
      ],
      "status": "needs_native_evidence"
    },
    {
      "target": "hermes/windows/amd64/native",
      "native_checks_recorded": [],
      "gaps": [
        "discovery",
        "normal_execution",
        "pre_execution_denial",
        "service_unavailable_denial",
        "approval_resume",
        "final_parameter_recheck",
        "skill_attribution",
        "install_interception"
      ],
      "status": "needs_native_evidence"
    },
    {
      "target": "hermes/windows/amd64/wsl2",
      "native_checks_recorded": [],
      "gaps": [
        "discovery",
        "normal_execution",
        "pre_execution_denial",
        "service_unavailable_denial",
        "approval_resume",
        "final_parameter_recheck",
        "skill_attribution",
        "install_interception"
      ],
      "status": "needs_native_evidence"
    },
    {
      "target": "hermes/macos/arm64/native",
      "native_checks_recorded": [],
      "gaps": [
        "discovery",
        "normal_execution",
        "pre_execution_denial",
        "service_unavailable_denial",
        "approval_resume",
        "final_parameter_recheck",
        "skill_attribution",
        "install_interception"
      ],
      "status": "needs_native_evidence"
    },
    {
      "target": "hermes/macos/amd64/native",
      "native_checks_recorded": [],
      "gaps": [
        "discovery",
        "normal_execution",
        "pre_execution_denial",
        "service_unavailable_denial",
        "approval_resume",
        "final_parameter_recheck",
        "skill_attribution",
        "install_interception"
      ],
      "status": "needs_native_evidence"
    },
    {
      "target": "hermes/linux/amd64/native",
      "native_checks_recorded": [],
      "gaps": [
        "discovery",
        "normal_execution",
        "pre_execution_denial",
        "service_unavailable_denial",
        "approval_resume",
        "final_parameter_recheck",
        "skill_attribution",
        "install_interception"
      ],
      "status": "needs_native_evidence"
    },
    {
      "target": "hermes/linux/arm64/native",
      "native_checks_recorded": [],
      "gaps": [
        "discovery",
        "normal_execution",
        "pre_execution_denial",
        "service_unavailable_denial",
        "approval_resume",
        "final_parameter_recheck",
        "skill_attribution",
        "install_interception"
      ],
      "status": "needs_native_evidence"
    },
    {
      "target": "workbuddy/windows/amd64/native",
      "native_checks_recorded": [],
      "gaps": [
        "discovery",
        "normal_execution",
        "pre_execution_denial",
        "service_unavailable_denial",
        "approval_resume",
        "final_parameter_recheck",
        "skill_attribution",
        "install_interception"
      ],
      "status": "needs_native_evidence"
    },
    {
      "target": "workbuddy/windows/amd64/wsl2",
      "native_checks_recorded": [],
      "gaps": [
        "discovery",
        "normal_execution",
        "pre_execution_denial",
        "service_unavailable_denial",
        "approval_resume",
        "final_parameter_recheck",
        "skill_attribution",
        "install_interception"
      ],
      "status": "needs_native_evidence"
    },
    {
      "target": "workbuddy/macos/arm64/native",
      "native_checks_recorded": [],
      "gaps": [
        "discovery",
        "normal_execution",
        "pre_execution_denial",
        "service_unavailable_denial",
        "approval_resume",
        "final_parameter_recheck",
        "skill_attribution",
        "install_interception"
      ],
      "status": "needs_native_evidence"
    },
    {
      "target": "workbuddy/macos/amd64/native",
      "native_checks_recorded": [],
      "gaps": [
        "discovery",
        "normal_execution",
        "pre_execution_denial",
        "service_unavailable_denial",
        "approval_resume",
        "final_parameter_recheck",
        "skill_attribution",
        "install_interception"
      ],
      "status": "needs_native_evidence"
    },
    {
      "target": "workbuddy/linux/amd64/native",
      "native_checks_recorded": [],
      "gaps": [
        "discovery",
        "normal_execution",
        "pre_execution_denial",
        "service_unavailable_denial",
        "approval_resume",
        "final_parameter_recheck",
        "skill_attribution",
        "install_interception"
      ],
      "status": "needs_native_evidence"
    },
    {
      "target": "workbuddy/linux/arm64/native",
      "native_checks_recorded": [],
      "gaps": [
        "discovery",
        "normal_execution",
        "pre_execution_denial",
        "service_unavailable_denial",
        "approval_resume",
        "final_parameter_recheck",
        "skill_attribution",
        "install_interception"
      ],
      "status": "needs_native_evidence"
    }
  ]
}
